;Abertura da Proposta;Edital;Endereço;Entrega da Proposta;Fax;Objeto;Telefone;preg_cod
90; em 30/08/2017 às 09:00Hs, no endereço: www.comprasnet.gov.br;17/08/2017 das 08:30 às 11:50 Hs e das 13:00 às 15:30 Hs;Praia da Bica 1361 - Ilha do Governador -  - Rio de Janeiro (RJ); a partir de 17/08/2017 às 08:30Hs;(0xx21) 21265995      ;Objeto: Pregão Eletrônico -  Aquisição eventual de Gás liquefeito de petróleo (GLP), engarrafado em cilindros ou botijões de 45 Kg e 20 Kg, para aplicação em cozinha e empilhadeiras industriais, conforme condições, quantidades, exigências e estimativas estabelecidas neste Termo de Referência.;(0xx21) 21265981;132017
91; em 26/09/2017 às 09:15Hs, no endereço: www.comprasnet.gov.br;14/09/2017 das 08:30 às 11:45 Hs e das 13:00 às 15:30 Hs;Praia da Bica 1361 - Ilha do Governador -  - Rio de Janeiro (RJ); a partir de 14/09/2017 às 08:30Hs;(0xx21) 21265995      ;"Objeto: Pregão Eletrônico -  AQUISIÇÃO DE EQUIPAMENTOS, SERVIÇOS, INSUMOS E TREINAMENTO, PARA A REALIZAÇÃO DE ANÁLISES DE COMBUSTÍVEIS NO LABORATÓRIO; BARREIRAS DE CONTENÇÃO DE COMBUSTÍVEIS NO MAR; MATERIAIS DE MARINHARIA; MATERIAIS DE CARPINTARIA; MATERIAIS DE METALURGIA; EQUIPAMENTOS DE REFRIGERAÇÃO;  E EQUIPAMENTOS PARA COZINHA INDUSTRIAL do DepCMRJ, conforme especificações, condições, quantidades, exigências e estimativas estabelecidas neste Termo de Referência.";(0xx21) 21265981;182017
92; em 06/12/2017 às 08:30Hs, no endereço: www.comprasnet.gov.br;24/11/2017 das 08:30 às 11:45 Hs e das 13:00 às 15:30 Hs;Praia da Bica 1361 - Ilha do Governador -  - Rio de Janeiro (RJ); a partir de 24/11/2017 às 08:30Hs;(0xx21) 21265981      ;Objeto: Pregão Eletrônico -  Aquisição de material e serviços de combate a incêndio e controle a acidente ambiental para Seção de Meio Ambiente  fornecidos ao Depósito de Combustíveis da Marinha no Rio de Janeiro, conforme condições, quantidades, exigências e estimativas,   estabelecidas neste instrumento;(0xx21) 21265995;192017
93; em 30/04/2018 às 09:00Hs, no endereço: www.comprasnet.gov.br;17/04/2018 das 08:00 às 11:50 Hs e das 13:00 às 15:00 Hs;Praia da Bica 1361 - Ilha do Governador -  - Rio de Janeiro (RJ); a partir de 17/04/2018 às 08:00Hs;(0xx21) 21265995      ;Objeto: Pregão Eletrônico -  Registro de preços para a escolha da proposta mais vantajosa para a contratação de serviços comuns de engenharia de manutenção nas redes de combustíveis e materiais  do, contemplando o fornecimento de todo material necessário à sua execução, para atender suas necessidades conforme o Edital e as especificações e quantitativos estabelecidos especificações e quantitativos estabelecidos, com FORNECIMENTO DE TODO O MATERIAL, SOBRESSALTANTES,PEÇAS E COMPONENTES (NOVOS E ORIGINAIS);(0xx21) 21265980;202017
94; em 19/12/2017 às 08:30Hs, no endereço: www.comprasnet.gov.br;07/12/2017 das 08:30 às 11:45 Hs e das 13:00 às 15:30 Hs;Praia da Bica 1361 - Ilha do Governador -  - Rio de Janeiro (RJ); a partir de 07/12/2017 às 08:30Hs;(0xx21) 21265995      ;"Objeto: Pregão Eletrônico -  O objeto da presente licitação é o registro de preços para escolha da proposta mais vantajosa para aquisição de equipamentos, serviços, insumos e treinamento, para a realização de análises de combustíveis no laboratório;  materiais em geral para as instalações do Depósito de Combustíveis da Marinha no Rio de Janeiro, conforme especificações,  condições, quantidades, exigências e estimativas estabelecidas neste Edital e seus Anexos.";(0xx21) 21265981;222017
